title,company,location,summary,salary
Entry Level Intelligence Analyst (Full Training Provided),Royal Australian Navy,Australia,"A role as an Entry Level Intelligence Analyst (known in the Navy as Cryptologic Linguist) is exciting, challenging and immensely rewarding.", 89999
Data Analyst COVID 19,Health System Support Group,Sydney NSW,"Liaise with data providers & subject matter experts to ensure correct translation between source data and stored data.
Prepare data for state-wide reporting.", 100090
"Data Analyst, EL1, Sydney, Canberra or Melbourne",Australian Trade Commission (Austrade),Sydney NSW,"You will be responsible for data analysis, data quality checks and providing data advice to ensure reliable, trustworthy scalable data is made available within…", 114031
Data Analyst - Sydney CBD,Johnathan Thurston Academy,Sydney NSW,"Experience as a data analyst or related field – BI/Business Analysis.
Assist in the normalisation and development of data assets, including developing cleansing…",106236.58
Business Analyst,Robert Half,Australia,"Impressive experience working on projects with complex integration and multiple systems data.
Your business know-how means you are easily able to perform due…",106236.58
Data Analyst - Customer Growth,Flexigroup,Sydney NSW,"Ability to interpret new data sources and extraction/manipulation of large data sets to perform analytics.
Should have a deep understanding of Enterprise Data…",106236.58
Data Analyst,PKF Australia,Sydney NSW,"We are currently seeking a data analyst to join our growing team in Newcastle or Sydney, NSW.
Experience in predictive analytics techniques and data modelling.",106236.58
"Data Analyst – Economic Analysis Department, RBA",Reserve Bank of Australia,Sydney NSW,On top of that you will update data in the various data repositories (databases and spreadsheets) in a timely and accurate manner.,106236.58
Junior Data Analyst/Scientist,International Institute of Data & Analytics,Sydney NSW,"In data science and big data analytics, the IDA creates enablers for:
Understand data structures and business and extract and integrate required data sources…",106236.58
Research and Data Analyst,Chandler Macleod,Australia,"Qualifications, experience and skills in a data analytic role is essential, including a demonstrated ability to interrogate information management systems…",106236.58
Data Analyst - Australian Data,ANZ Banking Group,Australia,"Strong ability to translate data insights into practical business recommendations.
Address and solve complex business issues using large amounts of data.",106236.58
"Customer Data Analyst, Australia",OakNorth Bank,Sydney NSW,"A CA is responsible for working with client bank analysts to understand their processes and requirements for credit decisions, portfolio monitoring and data…",106236.58
Data Analyst,Access Corporate Group,North Sydney NSW,"Produce actionable business insights via data mining and data modelling.
3+ years in a data- analysis role with demonstrated experience in data integration and…",106236.58
Data Analyst,Showpo,Remote,"Identify gaps in our data, and work with the Dev team to integrate necessary data into our data warehouse.
Utilise data sources to make forecasts / predictions.",106236.58
Data Analyst,Invoice2go,Sydney NSW,"Build and maintain metrics dashboard using a data visualization tool.
We are looking for curious and enthusiastic analysts who can thrive in a constantly…", 80000
Data Analyst - Energy Fleet Analytics (Melbourne),Tesla,Cremorne VIC,"Write reproducible data analysis over petabytes of data using cutting-edge open source technologies.
Build data pipelines to promote your ad-hoc data analyses…",106236.58
Data & Visualisation Analyst,HSBC,Sydney NSW,"Interrogation of complex and disparate data sources.
Development of efficient and effective automated data processes.
Some careers have more impact than others.",106236.58
Data Analyst,GetCapital,Sydney NSW,"Experience in data visualisation and dashboard creation.
Teach and encourage colleagues to be their own data miners.
What you didn’t know about GetCapital.",106236.58
Data & Reporting Analyst,Westpac Group,Parramatta NSW,"Experience in using and building data models Teradata is highly recommended.
A previous experience in creation of data models from scratch and documentation of…",106236.58
Data Analyst,Experis,Sydney Central Business District NSW,"Extensive, hands-on data analysis experience - including a thorough appreciation of how data flows through systems, relationships between data, and data…",106236.58
Data Analyst,SA Health,Adelaide SA,"The Data Analyst is responsible for supporting CALHN's Business Intelligence and Performance Reporting Unit to deliver trusted, timely and actionable data to…",106236.58
Data Analyst,Greythorn,Sydney NSW,"Extensive, hands-on data analysis experience - including a thorough appreciation of how data flows through systems, relationships between data, and data…",106236.58
Senior Data Migration Analyst,Lion,Australia,"We are looking for someone with strong experience as a data migration specialist, and working knowledge of big data, cloud computing and machine learning, along…",106236.58
Junior Data Analyst (Contract),Veeva Systems,Sydney NSW,"Implement automated data collection and validation processes.
Analyse and perform data matching, cleansing, validation and load on incoming customer data by…",106236.58
Data Business Analyst - Max term opportunity,Macquarie Group Limited,Sydney NSW,"Over three years of experience in data and/or technical business analyst roles.
Analyse existing data sources including the enterprise data warehouse to…",106236.58
Data Analyst - Contract role,oOh!,North Sydney NSW,"Proactively solve business problems with data and show strong competency in clear data visualisation and reporting.
And when we do that well, we celebrate it.",106236.58
Data Analyst,Finite IT,Sydney NSW,"Locate and define new process improvement opportunities in the sourcing, management and maintenance of enterprise data.",170000.0
"Senior Data Analyst, Data Analytics & Robotics",Optus,Sydney NSW,"Performing more complex data analytic work.
Excellent decision-making skills underpinned by a strong data science foundation.",106236.58
Data & Operations Graduate,Crimson Education,Remote,The Strategy Operations Analyst holds a key role within our Strategy Consulting team: they will enable stronger student outcomes by providing data-backed…,106236.58
Data Scientist,Vodafone,North Sydney NSW,"Collect, aggregate and analyse data from multiple internal and external sources to drive actionable insights.
2-3+ years of hands on experience in data science,…",106236.58
Systems Analyst,Chief Group Services,Australia,"An applicant with digital data visualisation expertise and experience working with Oracle Bi is preferable.
Our services include security and cleaning, car park…", 100000
Performance & Remuneration Analyst,Programmed,Australia,"Provide analytical support, data management and reporting for the annual remuneration review process and other cyclical processes e.g. performance management…",106236.58
Software/Data Engineer,Tardis Group,Australia,The position will form part of our established data services team and involve assisting our customer base in project delivery and production support of business…, 100000
Data Analyst,Showpo,Remote,"Identify gaps in our data, and work with the Dev team to integrate necessary data into our data warehouse.
Utilise data sources to make forecasts / predictions.",106236.58
Data Analyst,Invoice2go,Sydney NSW,"Build and maintain metrics dashboard using a data visualization tool.
We are looking for curious and enthusiastic analysts who can thrive in a constantly…", 80000
Data Analyst - Energy Fleet Analytics (Melbourne),Tesla,Cremorne VIC,"Write reproducible data analysis over petabytes of data using cutting-edge open source technologies.
Build data pipelines to promote your ad-hoc data analyses…",106236.58
Data & Visualisation Analyst,HSBC,Sydney NSW,"Interrogation of complex and disparate data sources.
Development of efficient and effective automated data processes.
Some careers have more impact than others.",106236.58
Data Analyst,GetCapital,Sydney NSW,"Experience in data visualisation and dashboard creation.
Teach and encourage colleagues to be their own data miners.
What you didn’t know about GetCapital.",106236.58
Data & Reporting Analyst,Westpac Group,Parramatta NSW,"Experience in using and building data models Teradata is highly recommended.
A previous experience in creation of data models from scratch and documentation of…",106236.58
Data Analyst,Experis,Sydney Central Business District NSW,"Extensive, hands-on data analysis experience - including a thorough appreciation of how data flows through systems, relationships between data, and data…",106236.58
Data Analyst,SA Health,Adelaide SA,"The Data Analyst is responsible for supporting CALHN's Business Intelligence and Performance Reporting Unit to deliver trusted, timely and actionable data to…",106236.58
Data Analyst,Greythorn,Sydney NSW,"Extensive, hands-on data analysis experience - including a thorough appreciation of how data flows through systems, relationships between data, and data…",106236.58
Data Analyst,Lendlease,Sydney Central Business District NSW,"Experience as a data analyst or related field – BI/Business Analysis.
Assist in the normalisation and development of data assets, including developing cleansing…",106236.58
ASD 5 - Security Audit Analyst and Reporter,Australian Government Department of Defence,Australia,"Ability to work with and translate technical data sets.
Adopting an analytical approach across various data sets to understand security risks.", 78873
Data Analyst,Lendlease,Australia,"Experience as a data analyst or related field – BI/Business Analysis.
Assist in the normalisation and development of data assets, including developing cleansing…",106236.58
Entry Level Intelligence Analyst (Full Training Provided),Royal Australian Navy,Australia,"A role as an Entry Level Intelligence Analyst (known in the Navy as Cryptologic Linguist) is exciting, challenging and immensely rewarding.", 89999
Data Analyst - Health Economics and Data Analysis,Curtin University of Technology,Perth WA,"Application of technical skills to real-world big data sets; with the ability to automate routine data processing activities.
In this role you will:",106236.58
Data Analyst RBS Customer Remediation,Commonwealth Bank,Sydney Central Business District NSW,"Provide data expertise in support of Remediation activities which will include information gathering, data analysis, design and building of data models.",106236.58
Inventory Analyst,Fisher & Paykel Appliances,Sydney NSW,This opportunity is best suited to a data driven Inventory Analyst who will be a strong cross functional ambassador across the organisation.,106236.58
APS Level 5 - Data Analyst,Australian Government - Department of Health,Woden ACT,As a Data Analyst within the Analytics Projects and Futures Section you will have the opportunity to contribute to the development of innovative ideas to tackle…,106236.58
Client Onboarding Data Analyst,Faethm,Sydney NSW,"A passion for all things data.
Familiarity with Tableau or other BI data viz tools desired.
Experience in processing, cleaning, organising and manipulating data…",106236.58
Analyst Programmer,University of Wollongong,Wollongong NSW,AHSRI is home to a team of software developers and IT specialists who participate in multi-disciplinary teams to support the AHSRI research programme by…, 96811
Data Analyst,Paxus,Sydney NSW,"Build end to end data lineage from source to reporting layer.
Ensure the completeness and coverage of all requirements (functional, non-functional, technical…",130000.0
Data Analyst - Brisbane,Johnathan Thurston Academy,Newstead QLD,"Contribute to data governance processes and procedures.
This includes developing data sets for evolving analytics requirements.
Our client: Bank of Queensland.",106236.58
Economic Analyst,REA Group,Sydney NSW,"Experience working with property data.
Access unparalleled property and behavioural data.
Collaborate with product, design, data science and economics teams to…",106236.58
Remediation Analyst,TAL,Sydney NSW,"Delivering weekly remediation reporting data and stakeholder reporting.
Remediation Analyst – 6 month Fixed Term Contract.
Welcome to This Australian Life.",106236.58
Senior Data Analyst,Health System Support Group,Sydney NSW,"Prepare high quality data visualisations and other data products when requested.
Liaison with data providers, data users, subject matter experts and other…", 129658
Pricing Data Analyst - Macquarie Park,Blackwoods,Sydney NSW,"Solid experience working as a data analyst.
Collecting data from various data sources to develop pricing models/ data models.
Coding using SQL, Python, Pyspark.",106236.58
Pricing Analyst,Origin Energy Services Ltd,Barangaroo NSW,"Join a highly engaged team of professionals in the Energy sector.
Provide analysis and reporting to capture value in the existing portfolio.",106236.58
Accounting Data Analyst,Epoch Capital,Sydney NSW,"The data analyst will focus on seeking out opportunities in the team's workflow to automate and iron out inefficiencies.
What the role is all about….",106236.58
Business Process Mapping/Data Governance Officer,CareCone Australia,Sydney NSW,"Lead a team of 4-5 analyst on delivery.
Urgent requirement for Business Process Mapping/Data Governance Officer.
Strong analytical and time management skills.",110000.0
Entry Level Intelligence Analyst (Full Training Provided),Royal Australian Navy,Australia,"A role as an Entry Level Intelligence Analyst (known in the Navy as Cryptologic Linguist) is exciting, challenging and immensely rewarding.", 89999
Migration Analyst,Programmed,Australia,"Assist in the resolution of data quality issues and discrepancies in data between legacy systems and source agreements.
Must have experience using Loan IQ.",106236.58
GIS Analyst,CGC Recruitment,Australia,"Demonstrated GIS skills and experience in management of spatial data.
Must have prior experience using ArcGIS and ability to manage spatial data.",106236.58
Junior Data Analyst (Contract),Veeva Systems,Sydney NSW,"Implement automated data collection and validation processes.
Analyse and perform data matching, cleansing, validation and load on incoming customer data by…",106236.58
Data Business Analyst - Max term opportunity,Macquarie Group Limited,Sydney NSW,"Over three years of experience in data and/or technical business analyst roles.
Analyse existing data sources including the enterprise data warehouse to…",106236.58
Data Analyst - Contract role,oOh!,North Sydney NSW,"Proactively solve business problems with data and show strong competency in clear data visualisation and reporting.
And when we do that well, we celebrate it.",106236.58
Data Analyst,Finite IT,Sydney NSW,"Locate and define new process improvement opportunities in the sourcing, management and maintenance of enterprise data.",170000.0
"Senior Data Analyst, Data Analytics & Robotics",Optus,Sydney NSW,"Performing more complex data analytic work.
Excellent decision-making skills underpinned by a strong data science foundation.",106236.58
Data & Operations Graduate,Crimson Education,Remote,The Strategy Operations Analyst holds a key role within our Strategy Consulting team: they will enable stronger student outcomes by providing data-backed…,106236.58
Data Scientist,Vodafone,North Sydney NSW,"Collect, aggregate and analyse data from multiple internal and external sources to drive actionable insights.
2-3+ years of hands on experience in data science,…",106236.58
Data Analyst - Health Economics and Data Analysis,Curtin University of Technology,Perth WA,"Application of technical skills to real-world big data sets; with the ability to automate routine data processing activities.
In this role you will:",106236.58
Data Analyst RBS Customer Remediation,Commonwealth Bank,Sydney Central Business District NSW,"Provide data expertise in support of Remediation activities which will include information gathering, data analysis, design and building of data models.",106236.58
Inventory Analyst,Fisher & Paykel Appliances,Sydney NSW,This opportunity is best suited to a data driven Inventory Analyst who will be a strong cross functional ambassador across the organisation.,106236.58
Data Analyst,Lendlease,Australia,"Experience as a data analyst or related field – BI/Business Analysis.
Assist in the normalisation and development of data assets, including developing cleansing…",106236.58
Head of Data Product,News Corp Australia,Australia,"Developed for both internal and external customers, News Connect is pivotal in driving the evolution of News Corp’s data monetisation capabilities and…",106236.58
Systems Analyst,Chief Group Services,Australia,"An applicant with digital data visualisation expertise and experience working with Oracle Bi is preferable.
Our services include security and cleaning, car park…", 100000
Pricing Analyst,Origin Energy Services Ltd,Barangaroo NSW,"Join a highly engaged team of professionals in the Energy sector.
Provide analysis and reporting to capture value in the existing portfolio.",106236.58
Accounting Data Analyst,Epoch Capital,Sydney NSW,"The data analyst will focus on seeking out opportunities in the team's workflow to automate and iron out inefficiencies.
What the role is all about….",106236.58
Business Process Mapping/Data Governance Officer,CareCone Australia,Sydney NSW,"Lead a team of 4-5 analyst on delivery.
Urgent requirement for Business Process Mapping/Data Governance Officer.
Strong analytical and time management skills.",110000.0
Data Operations Analyst,Westpac Group,Sydney Central Business District NSW,"Strong business analysis and data skills.
Perform data quality monitoring activities for the customer domain.
What’s in it for me?",106236.58
Data & Insight Analyst,New World Management,Sydney NSW,"Ability to understand, manage and manipulate complex data.
Experience with data manipulation tools (e.g. AWS Athena, Microsoft SQL) and visualisation tools (e.g…",106236.58
Senior Data Analyst,SBS,Sydney NSW,"Strong proficiency in data warehousing and data modelling concepts.
Contributed to a shared understanding of data analytics methodologies and liaise with…",106236.58
Specialist Data Analyst,BHP,Queensland,"Expert knowledge and experience with various data platforms, programming languages (such as R or Python) and technology used in data analysis, analytics and…",106236.58
Senior Data Analyst,Commonwealth Bank,Sydney Central Business District NSW,"End-to end ownership and delivery of data-driven remediation projects:
Have 4-6 years’ experience working in roles involving data analysis, Management…",106236.58
"Expressions of Interest- Strategy, Growth & Digital",KPMG,Sydney NSW,"Our mission is to assist organisations turn their data into strategic assets, developing data strategies and data management practices that enable responsible…",106236.58
Data Analyst Visualisation,Sustainability Victoria,Melbourne City Centre VIC,The Data Analyst - Visualisation will work as part of the Recycling industry Support team to develop solutions derived from multiple data sources using a range…,106236.58
"Analyst, Complaints Risks & Incidents",AMP Limited,St Leonards NSW,"Support the team to manage the review of complaints data to identify, record and refer Incidents and Potential Systemic Issues as they relate to complaints…",106236.58
Service Integrity analyst,Nielsen,Macquarie Park NSW,"Providing support to the data delivery team to ensure daily data delivery according to contractual KPI’s and commitments.
A Little Bit About you.",106236.58
Analyst - Marketing Analytics,Westpac Group,Sydney Central Business District NSW,"Also performing 'QA' for team analysts.
This role will enable Westpac to become data-driven, by infusing information and analytics across the business and will…",106236.58
Digital Data Analyst,Kimberly-Clark,Milsons Point NSW,"Strong technical skills across data, database marketing, CRM, data extraction, analytics and/or data visualisation;
Global VISA and Relocation Specifications:",106236.58
"Senior Analyst, Data Governance",Macquarie Group Limited,Sydney NSW,"Identifying potential data risks and issues and assessing them against their mitigating controls.
Understanding and documenting end-to-end data flows and system…",106236.58
Business Process Mapping/Data Governance Officer,CareCone Australia,Sydney NSW,"Lead a team of 4-5 analyst on delivery.
Urgent requirement for Business Process Mapping/Data Governance Officer.
Strong analytical and time management skills.",110000.0
Data Operations Analyst,Westpac Group,Sydney Central Business District NSW,"Strong business analysis and data skills.
Perform data quality monitoring activities for the customer domain.
What’s in it for me?",106236.58
Data & Insight Analyst,New World Management,Sydney NSW,"Ability to understand, manage and manipulate complex data.
Experience with data manipulation tools (e.g. AWS Athena, Microsoft SQL) and visualisation tools (e.g…",106236.58
Senior Data Analyst,SBS,Sydney NSW,"Strong proficiency in data warehousing and data modelling concepts.
Contributed to a shared understanding of data analytics methodologies and liaise with…",106236.58
Specialist Data Analyst,BHP,Queensland,"Expert knowledge and experience with various data platforms, programming languages (such as R or Python) and technology used in data analysis, analytics and…",106236.58
Senior Data Analyst,Commonwealth Bank,Sydney Central Business District NSW,"End-to end ownership and delivery of data-driven remediation projects:
Have 4-6 years’ experience working in roles involving data analysis, Management…",106236.58
"Expressions of Interest- Strategy, Growth & Digital",KPMG,Sydney NSW,"Our mission is to assist organisations turn their data into strategic assets, developing data strategies and data management practices that enable responsible…",106236.58
Data Analyst Visualisation,Sustainability Victoria,Melbourne City Centre VIC,The Data Analyst - Visualisation will work as part of the Recycling industry Support team to develop solutions derived from multiple data sources using a range…,106236.58
"Analyst, Complaints Risks & Incidents",AMP Limited,St Leonards NSW,"Support the team to manage the review of complaints data to identify, record and refer Incidents and Potential Systemic Issues as they relate to complaints…",106236.58
Service Integrity analyst,Nielsen,Macquarie Park NSW,"Providing support to the data delivery team to ensure daily data delivery according to contractual KPI’s and commitments.
A Little Bit About you.",106236.58
Analyst - Marketing Analytics,Westpac Group,Sydney Central Business District NSW,"Also performing 'QA' for team analysts.
This role will enable Westpac to become data-driven, by infusing information and analytics across the business and will…",106236.58
Digital Data Analyst,Kimberly-Clark,Milsons Point NSW,"Strong technical skills across data, database marketing, CRM, data extraction, analytics and/or data visualisation;
Global VISA and Relocation Specifications:",106236.58
"Senior Analyst, Data Governance",Macquarie Group Limited,Sydney NSW,"Identifying potential data risks and issues and assessing them against their mitigating controls.
Understanding and documenting end-to-end data flows and system…",106236.58
SENIOR BUSINESS INTELLIGENCE/DATA ANALYST,City of Sydney,Sydney Central Business District NSW,"Assisting business areas discover insights through data analysis, reporting, and visualisation.
Experience working on data integration projects developing,…",106236.58
GIS Analyst,CGC Recruitment,Australia,"Demonstrated GIS skills and experience in management of spatial data.
Must have prior experience using ArcGIS and ability to manage spatial data.",106236.58
Lean Analyst,Westpac Group,Sydney NSW,"Business process improvement/re-engineering, data analysis, system functional / non-functional analysis experience and business case preparation experience.",106236.58
Junior Insights Analyst,Oneflare,Sydney NSW,"Contribute to the product roadmap through data-based recommendations.
Data evangelist within squads for best data and analytics practices.",106236.58
Suncorps 2021 Technology Graduate Program,Suncorp Group,Australia,Banking & Wealth Technology: Software Engineers (Brisbane); Systems engineer (Brisbane); Developer (Brisbane); Business analyst (Brisbane).,106236.58
Data Analyst,Servian,Sydney NSW,"Sound understanding of data structures, data modeling and data optimisation techniques.
Implement solutions for the establishment of data analysis capabilities…",106236.58
"Business Analyst (Sydney, Canberra, Adelaide, Brisbane)",Tata Consultancy Services (TCS),Sydney NSW,Ability to query complex data warehouses and aggregate data for strategic reporting; experience with Teradata/SQL is highly desirable., 120000
Expressions of Interest- Forensic Advisory,KPMG,Sydney NSW,"Manipulating data into meaningful formats, reports and statistics;
Analysis of financial crime compliance policies, procedures and data.",106236.58
APS 5 Business Intelligence Analyst,Australian Taxation Office,Australia,"We are seeking data driven and creative thinkers to join our Strategy and Governance branch.
As a Business Intelligence Analyst, in Law Design and Practice, you…",106236.58
"Systems Analyst (Sydney, Melbourne, Brisbane, Canberra)",Tata Consultancy Services (TCS),Sydney NSW,"Designs and validates data models that provide logical data interpretation.
Networks with various stakeholders (internal and external) conducts interview s and…", 110000
